{
  "schema": "k1.control-profile/2",
  "profile_id": 1,
  "profile_revision": 1,
  "label": "Channel-first default",
  "registry": {
    "schema": "k1.control-registry/2",
    "major": 2
  },
  "channels": [
    {
      "channel": "primary",
      "pages": [
        {
          "page_id": 1,
          "kind": "perform",
          "label": "Perform",
          "slots": [
            {
              "slot": 1,
              "parameter": "channel_intensity",
              "range": {
                "min": 0,
                "max": 1
              },
              "mapping": {
                "kind": "linear"
              },
              "inverted": false,
              "modality": "absolute",
              "input": {
                "steps": 4096,
                "hysteresis": 0.002
              },
              "quantisation": {
                "step": 0
              },
              "response": "exp_60ms",
              "takeover": {
                "mode": "pickup",
                "tolerance": 0.015
              }
            },
            {
              "slot": 2,
              "parameter": "liveiness",
              "range": {
                "min": 0,
                "max": 1
              },
              "mapping": {
                "kind": "linear"
              },
              "inverted": false,
              "modality": "absolute",
              "input": {
                "steps": 4096,
                "hysteresis": 0.002
              },
              "quantisation": {
                "step": 0
              },
              "response": "exp_60ms",
              "takeover": {
                "mode": "pickup",
                "tolerance": 0.015
              }
            },
            {
              "slot": 3,
              "parameter": "motion",
              "range": {
                "min": 0,
                "max": 240
              },
              "mapping": {
                "kind": "exponent",
                "exponent": 2
              },
              "inverted": false,
              "modality": "absolute",
              "input": {
                "steps": 4096,
                "hysteresis": 0.002
              },
              "quantisation": {
                "step": 0
              },
              "response": "exp_60ms",
              "takeover": {
                "mode": "pickup",
                "tolerance": 0.015
              }
            },
            {
              "slot": 4,
              "parameter": "width",
              "range": {
                "min": 0.5,
                "max": 24
              },
              "mapping": {
                "kind": "log"
              },
              "inverted": false,
              "modality": "absolute",
              "input": {
                "steps": 4096,
                "hysteresis": 0.002
              },
              "quantisation": {
                "step": 0
              },
              "response": "exp_60ms",
              "takeover": {
                "mode": "pickup",
                "tolerance": 0.015
              }
            },
            {
              "slot": 5,
              "parameter": "persistence",
              "range": {
                "min": 0.02,
                "max": 4
              },
              "mapping": {
                "kind": "log"
              },
              "inverted": false,
              "modality": "absolute",
              "input": {
                "steps": 4096,
                "hysteresis": 0.002
              },
              "quantisation": {
                "step": 0
              },
              "response": "exp_60ms",
              "takeover": {
                "mode": "pickup",
                "tolerance": 0.015
              }
            },
            {
              "slot": 6,
              "parameter": "rhythm_mix",
              "range": {
                "min": 0,
                "max": 1
              },
              "mapping": {
                "kind": "linear"
              },
              "inverted": false,
              "modality": "absolute",
              "input": {
                "steps": 4096,
                "hysteresis": 0.002
              },
              "quantisation": {
                "step": 0
              },
              "response": "exp_60ms",
              "takeover": {
                "mode": "pickup",
                "tolerance": 0.015
              }
            },
            {
              "slot": 7,
              "parameter": "audio_focus",
              "range": {
                "min": 0,
                "max": 1
              },
              "mapping": {
                "kind": "linear"
              },
              "inverted": false,
              "modality": "absolute",
              "input": {
                "steps": 4096,
                "hysteresis": 0.002
              },
              "quantisation": {
                "step": 0
              },
              "response": "exp_60ms",
              "takeover": {
                "mode": "pickup",
                "tolerance": 0.015
              }
            },
            {
              "slot": 8,
              "parameter": "palette_position",
              "range": {
                "min": 0,
                "max": 1
              },
              "mapping": {
                "kind": "linear"
              },
              "inverted": false,
              "modality": "absolute",
              "input": {
                "steps": 4096,
                "hysteresis": 0.002
              },
              "quantisation": {
                "step": 0
              },
              "response": "exp_60ms",
              "takeover": {
                "mode": "pickup",
                "tolerance": 0.015
              }
            },
            {
              "slot": 9,
              "parameter": "palette_travel",
              "range": {
                "min": 0,
                "max": 1
              },
              "mapping": {
                "kind": "linear"
              },
              "inverted": false,
              "modality": "absolute",
              "input": {
                "steps": 4096,
                "hysteresis": 0.002
              },
              "quantisation": {
                "step": 0
              },
              "response": "exp_60ms",
              "takeover": {
                "mode": "pickup",
                "tolerance": 0.015
              }
            }
          ]
        },
        {
          "page_id": 2,
          "kind": "colour",
          "label": "Colour",
          "slots": [
            {
              "slot": 1,
              "parameter": "palette_position",
              "range": {
                "min": 0,
                "max": 1
              },
              "mapping": {
                "kind": "linear"
              },
              "inverted": false,
              "modality": "absolute",
              "input": {
                "steps": 4096,
                "hysteresis": 0.002
              },
              "quantisation": {
                "step": 0
              },
              "response": "exp_60ms",
              "takeover": {
                "mode": "pickup",
                "tolerance": 0.015
              }
            },
            {
              "slot": 2,
              "parameter": "palette_span",
              "range": {
                "min": 0.02,
                "max": 1
              },
              "mapping": {
                "kind": "linear"
              },
              "inverted": false,
              "modality": "absolute",
              "input": {
                "steps": 4096,
                "hysteresis": 0.002
              },
              "quantisation": {
                "step": 0
              },
              "response": "exp_60ms",
              "takeover": {
                "mode": "pickup",
                "tolerance": 0.015
              }
            },
            {
              "slot": 3,
              "parameter": "palette_travel",
              "range": {
                "min": 0,
                "max": 1
              },
              "mapping": {
                "kind": "linear"
              },
              "inverted": false,
              "modality": "absolute",
              "input": {
                "steps": 4096,
                "hysteresis": 0.002
              },
              "quantisation": {
                "step": 0
              },
              "response": "exp_60ms",
              "takeover": {
                "mode": "pickup",
                "tolerance": 0.015
              }
            },
            {
              "slot": 4,
              "parameter": "saturation",
              "range": {
                "min": 0,
                "max": 1
              },
              "mapping": {
                "kind": "linear"
              },
              "inverted": false,
              "modality": "absolute",
              "input": {
                "steps": 4096,
                "hysteresis": 0.002
              },
              "quantisation": {
                "step": 0
              },
              "response": "exp_60ms",
              "takeover": {
                "mode": "pickup",
                "tolerance": 0.015
              }
            },
            {
              "slot": 5,
              "parameter": "warmth",
              "range": {
                "min": -1,
                "max": 1
              },
              "mapping": {
                "kind": "linear"
              },
              "inverted": false,
              "modality": "absolute",
              "input": {
                "steps": 4096,
                "hysteresis": 0.002
              },
              "quantisation": {
                "step": 0
              },
              "response": "exp_60ms",
              "takeover": {
                "mode": "pickup",
                "tolerance": 0.015
              }
            },
            {
              "slot": 6,